{
  "schemaVersion": "1.0",
  "sourceRevision": "ad5cd8bc9a9a2c541416390aa4256bc1ffe1eee7",
  "imageIdentity": "sha256:bcdd1c8d4234ff8de8edbd1f3c52fe06c1a97d876d1c6a8996928bdff4376f2c",
  "gateResults": [
    {
      "evidenceId": "EVD-SLICE-STATIC-001",
      "gateId": "GATE-STATIC-01",
      "applicability": "Applicable",
      "subjectPaths": [
        "Dockerfile",
        "compose.yml",
        "codex/config.toml",
        "codex/requirements.toml",
        "opencode.jsonc",
        ".pre-commit-config.yaml",
        "docs/security/secure-development/2026-08-30-container-hardening/verification-evidence.json"
      ],
      "command": "bash scripts/test-ade-sandbox-hardening.sh --mode static --evidence docs/security/secure-development/2026-08-30-container-hardening/verification-evidence.json; python3 -m unittest scripts.tests.test_secure_development_container_hardening scripts.tests.test_agent_surface_parity; podman-compose config; git diff --check; container: Bash and PowerShell twelve-preset checks plus uvx pre-commit run --all-files",
      "runnerOrPlatform": "repository-local Ubuntu 24.04.4 under WSL2; Linux-native checkout; Bash and PowerShell 7.6.5 on host; canonical WSL2 container for missing host utilities",
      "startedAt": "2026-09-05T21:40:25Z",
      "finishedAt": "2026-09-05T21:43:43Z",
      "exitCode": 0,
      "expectedResult": "The complete Static mode, all repository tests, paired preset checks, Compose configuration, pre-commit hooks, and diff hygiene pass against the exact source head.",
      "observedResult": "Static mode returned GREEN with exit 0 against the editor-completed evidence patch. All 24 hardening tests, 4 dispatcher tests, 3 parity tests, both twelve-preset checks, Compose configuration, all four pre-commit hooks, and git diff --check passed against source revision ad5cd8bc9a9a2c541416390aa4256bc1ffe1eee7.",
      "result": "Pass",
      "freshness": "Current",
      "limitations": "Host-only uvx and ripgrep were absent, so the canonical WSL2 container executed those checks against the same Linux-native checkout mounted at /ade-dev-sandbox. Two initial container-user invocations of the 24-test suite could not create their temporary test directory directly in the Linux host mount; the binding Linux-native rerun as checkout owner thinder passed all 24 tests and the complete Static mode. This does not replace participant, human-role, or vulnerability-disposition evidence.",
      "artifactSha256": "7deaa7748868ca332194fd0a472d98452960b0e9f559bff182b1d5688e475cb4",
      "containsSensitiveContent": false,
      "rationale": "Static failures must be resolved before expensive build/runtime checks.",
      "reevaluationTrigger": "Any Dockerfile, Compose, script, test, contract, documentation, pre-commit configuration, or guidance change."
    },
    {
      "evidenceId": "EVD-SPEC-INPUT-001",
      "gateId": "GATE-SPEC-01",
      "applicability": "Applicable",
      "subjectPaths": [
        "Lastenheft_Secure-Development-Container-Hardening.md",
        "specs/003-secure-development-container-hardening/checklists/requirements.md",
        "specs/003-secure-development-container-hardening/autonomous-run-state.json",
        "docs/security/secure-development/2026-08-30-container-hardening/gap-dispositions.json"
      ],
      "command": "bash scripts/test-ade-sandbox-hardening.sh --mode input --evidence docs/security/secure-development/2026-08-30-container-hardening/verification-evidence.json; pwsh -NoLogo -NoProfile -File scripts/test-ade-sandbox-hardening.ps1 -Mode Input -EvidencePath docs/security/secure-development/2026-08-30-container-hardening/verification-evidence.json",
      "runnerOrPlatform": "repository-local macOS 26.6.2; Bash and PowerShell 7",
      "startedAt": "2026-08-30T13:27:12Z",
      "finishedAt": "2026-08-30T13:27:13Z",
      "exitCode": 0,
      "expectedResult": "Both entry points report six matching accepted hashes and the exact 157/108/49 partition without editing autonomous run state.",
      "observedResult": "Both entry points returned GREEN with exit code 0; six hashes, exact 157/108/49, zero missing/duplicate/extra IDs, zero mapping errors, and 49 unchanged open Human-only records matched.",
      "result": "Pass",
      "freshness": "Current",
      "limitations": "This input check does not satisfy later static, build, runtime, supply-chain, platform, learner, delivery, or human approval gates.",
      "artifactSha256": "fd3368c78616d757c5e9f0dc368cda98175f6d013ff41a33623cc9c81bf68111",
      "containsSensitiveContent": false,
      "rationale": "Input drift invalidates every later disposition and implementation decision.",
      "reevaluationTrigger": "Any accepted path/hash, spec, checklist, branch, scope, or run-state change."
    },
    {
      "evidenceId": "EVD-ASVS-NA-001",
      "gateId": "GATE-ASVS-NA-01",
      "applicability": "N/A",
      "subjectPaths": [
        "specs/003-secure-development-container-hardening/spec.md"
      ],
      "command": "N/A",
      "runnerOrPlatform": "N/A",
      "startedAt": "2026-08-30T13:16:13Z",
      "finishedAt": "2026-08-30T13:16:13Z",
      "exitCode": null,
      "expectedResult": "A reasoned applicability decision with no invented execution.",
      "observedResult": "The repository provides a container learning environment, not a first-party web, API, HTTP, authentication, or authorization service.",
      "result": "N/A",
      "freshness": "N/A",
      "limitations": "Generic learner port mappings do not constitute a first-party application endpoint.",
      "artifactSha256": "N/A",
      "containsSensitiveContent": false,
      "rationale": "The sandbox repository does not implement such a service; published learner ports are generic project mappings, not a first-party application endpoint.",
      "reevaluationTrigger": "A first-party web/API/HTTP/authentication/authorization service enters feature scope."
    },
    {
      "evidenceId": "EVD-AISBOM-NA-001",
      "gateId": "GATE-AISBOM-NA-01",
      "applicability": "N/A",
      "subjectPaths": [
        "specs/003-secure-development-container-hardening/spec.md"
      ],
      "command": "N/A",
      "runnerOrPlatform": "N/A",
      "startedAt": "2026-08-30T13:16:13Z",
      "finishedAt": "2026-08-30T13:16:13Z",
      "exitCode": null,
      "expectedResult": "A reasoned applicability decision with no invented execution.",
      "observedResult": "Agent and model use is limited to development tooling; no AI runtime component is delivered or operated by this feature.",
      "result": "N/A",
      "freshness": "N/A",
      "limitations": "CLI inventory and supplier transparency remain applicable governance evidence outside product AI-SBOM scope.",
      "artifactSha256": "N/A",
      "containsSensitiveContent": false,
      "rationale": "Agents and provider models are development tools; no model, dataset, or inference service is a released or operated sandbox runtime component.",
      "reevaluationTrigger": "An AI model, dataset, inference service, embedding store, or AI runtime becomes part of the delivered or operated system."
    },
    {
      "evidenceId": "EVD-ZT-NA-001",
      "gateId": "GATE-ZT-NA-01",
      "applicability": "N/A",
      "subjectPaths": [
        "specs/003-secure-development-container-hardening/spec.md"
      ],
      "command": "N/A",
      "runnerOrPlatform": "N/A",
      "startedAt": "2026-08-30T13:16:13Z",
      "finishedAt": "2026-08-30T13:16:13Z",
      "exitCode": null,
      "expectedResult": "A reasoned applicability decision with no invented execution.",
      "observedResult": "The target remains a local single-container learning sandbox; provider access is documented separately as a trust boundary.",
      "result": "N/A",
      "freshness": "N/A",
      "limitations": "The N/A decision does not approve provider access or unrestricted egress.",
      "artifactSha256": "N/A",
      "containsSensitiveContent": false,
      "rationale": "The target is a local single-container learning sandbox without remote management, multi-device policy plane, or service architecture; provider access remains documented as a trust boundary.",
      "reevaluationTrigger": "Remote management, multi-device, distributed service, cloud identity, or service-to-service architecture enters scope."
    },
    {
      "evidenceId": "EVD-CLOUD-NA-001",
      "gateId": "GATE-CLOUD-NA-01",
      "applicability": "N/A",
      "subjectPaths": [
        "specs/003-secure-development-container-hardening/spec.md"
      ],
      "command": "N/A",
      "runnerOrPlatform": "N/A",
      "startedAt": "2026-08-30T13:16:13Z",
      "finishedAt": "2026-08-30T13:16:13Z",
      "exitCode": null,
      "expectedResult": "A reasoned applicability decision with no invented execution.",
      "observedResult": "Cloud, hosting, managed-service, provider-deployment, and registry-distribution scope are excluded.",
      "result": "N/A",
      "freshness": "N/A",
      "limitations": "No BSI C3A/C5 or cloud-provider approval is claimed.",
      "artifactSha256": "N/A",
      "containsSensitiveContent": false,
      "rationale": "Registry distribution, hosting, SaaS/PaaS/IaaS, managed-service selection, and provider deployment are excluded.",
      "reevaluationTrigger": "Cloud, hosting, managed-service, provider-deployment, or registry-distribution scope is authorized."
    },
    {
      "evidenceId": "EVD-REGISTRY-NA-001",
      "gateId": "GATE-REGISTRY-NA-01",
      "applicability": "N/A",
      "subjectPaths": [
        "specs/003-secure-development-container-hardening/spec.md"
      ],
      "command": "N/A",
      "runnerOrPlatform": "N/A",
      "startedAt": "2026-08-30T13:16:13Z",
      "finishedAt": "2026-08-30T13:16:13Z",
      "exitCode": null,
      "expectedResult": "A reasoned applicability decision with no invented execution.",